{
  "version": 1,
  "id": "embodied-low-speed-sandbox",
  "title": "具身机器人低速沙盒",
  "tracks": [
    "civic-agent-governance"
  ],
  "users": [
    "机器人团队",
    "行人",
    "安全员"
  ],
  "context": "场景 02 位于众智园封闭庭院，采用限时、限域、可回滚的概念试验；Responsible Owner 负责，专业人员 Accountable，受影响群体 Consulted，公众 Informed。",
  "data_inputs": [
    "公开资料",
    "合成或隔离测试数据",
    "经单独授权的反馈"
  ],
  "public_value": "以具身机器人低速沙盒验证 AI 能力是否能在公共利益、人工接管和可逆性边界内工作。",
  "risks": [
    "用途漂移",
    "无法人工接管",
    "退出或恢复失败"
  ],
  "human_review": "高影响结果必须由可识别人类复核；越权、投诉阈值、不可复现或无法切回人工即停止，随后完成版本回滚、数据删除、设施撤场与公开复盘。"
}
